{
  "id": "TV-NE-001",
  "brand_profile": 65,
  "venue_quality": 72,
  "production_level": 75,
  "crowd_hotness_base": 60,
  "network_morality": 55,
  "card_time_cap": 120,
  "announcers": [
    "pbp1",
    "col1"
  ],
  "region": "Northeast",
  "variety_memory": {
    "recent_matchups": [
      [
        "ace",
        "brawler"
      ]
    ],
    "recent_stips": [
      "ladder"
    ],
    "recent_types": [
      "match",
      "promo"
    ]
  },
  "seed": 123456
}